title,price,brand,image_link,url,sub_category,category,gender,promotions,metadata_features
Havaianas Unisex Kid's Freedom Print Sandals,£5.89 - £21.99,Visit the Havaianas Store,https://m.media-amazon.com/images/I/414M9Z66lYL.jpg,https://www.amazon.co.uk/dp/B079WQTWY5,Sandals,Baby Girls,Female,11.00%,Outer Material: Synthetic  Inner Material: Manmade  Sole: Synthetic  Closure: Slip On  Shoe Width: Medium
Geox Boy's J Sveggen B ABX Classic Boots,,Visit the Geox Store,https://m.media-amazon.com/images/I/41rAvKQ4qEL.jpg,https://www.amazon.co.uk/dp/B0792P6S6P,Boots,Boys' Shoes,Male,13.00%,Outer Material: Synthetic  Inner Material: Textile  Sole: Ethylene Vinyl Acetate  Closure: Lace-Up  Heel Type: Flat  Fit Type: Geox shoes have a comfortable fit
GUESS Women's I-daygirl2-eu Gymnastics Shoe,£31.42 - £93.73,GUESS,https://m.media-amazon.com/images/I/31xsguSUicS.jpg,https://www.amazon.co.uk/dp/B08W8L24RR,Fashion Trainers,Fashion & Athletic Trainers,Female,39.00%,Outer Material: Synthetic  Lining: Fabric  Outer Material: Synthetic  Inner Material: Textile  Sole: Rubber  Closure: Lace-Up  Heel Type: No Heel  Shoe Width: Normale  Sole Material: Rubber  Closure: Lace-up
ASICS - Mens Gel-Ziruss 2 Shoes,£108.71 - £281.52,ASICS,https://m.media-amazon.com/images/I/51rOzUd9pkL.jpg,https://www.amazon.co.uk/dp/B07D9NVBM2,Road Running Shoes,Running Shoes,Male,38.00%,Outer Material: Synthetic  Sole: Rubber  Closure: Lace-Up  Shoe Width: Medium
Unisa Girl's Yadira_LMT Espadrilles,,Unisa,https://m.media-amazon.com/images/I/41z3wfvYGoL.jpg,https://www.amazon.co.uk/dp/B07Y8YN1FY,Espadrilles,Girls' Shoes,Female,12.00%,Outer Material: Leather  Inner Material: Manmade  Sole: Ethylene Vinyl Acetate  Closure: Hook & Loop  Shoe Width: Medium
DC Shoes Women's Villain 2 Skate Shoe,£38.78 - £50.75,DC Shoes,https://m.media-amazon.com/images/I/31tsE5p+8FL.jpg,https://www.amazon.co.uk/dp/B08G78C5J7,Fashion Trainers,Fashion & Athletic Trainers,Female,35.00%,Sole: Rubber  Closure: Pull On  Shoe Width: Medium
PUMA Softride Sophia Slip On Running Shoe  Peony-Pink Lady  13 US Unisex Little Kid,£43.81,Visit the PUMA Store,https://m.media-amazon.com/images/I/31OAIfBplIS.jpg,https://www.amazon.co.uk/dp/B08Q9WT1L9,Road Running Shoes,Running Shoes,Male,16.00%,Sole: Rubber  Closure: Pull On  Heel Type: No Heel  Shoe Width: Medium
Reebok Girl's Royal Comp CLN 2v Tennis Shoes,£19.99,Visit the Reebok Store,https://m.media-amazon.com/images/I/31Fv7j16seL.jpg,https://www.amazon.co.uk/dp/B07P1CSZNV,Tennis Shoes,Sports & Outdoor Shoes,Female,30.00%,Outer Material: Synthetic  Inner Material: Synthetic Fur  Sole: Rubber / Synthetic  Closure: Lace-Up  Heel Height: 4 centimetres  Heel Type: No Heel  Shoe Width: Medium  Product colour: White/Gold Sparkle  Product code: DV4147
Mark Nason Women's 133064 Sneaker,£53.11 - £66.80,Mark Nason,https://m.media-amazon.com/images/I/313yMBWK9jL.jpg,https://www.amazon.co.uk/dp/B08K3MY3J5,Fashion Trainers,Fashion & Athletic Trainers,Female,16.00%,Sole: Synthetic  Closure: Lace-Up  Heel Type: No Heel  Shoe Width: Medium
Merrell Men's Yokota 2 Waterproof Hiking Shoe,£138.30 - £271.82,Visit the Merrell Store,https://m.media-amazon.com/images/I/41wKjMOTAaL.jpg,https://www.amazon.co.uk/dp/B07QZYJN4Q,Trekking & Hiking Footwear,Sports & Outdoor Shoes,Male,17.00%,Outer Material: Synthetic  Sole: Rubber  Closure: Lace-Up  Shoe Width: Medium
Women’s Fashion Sneakers Perforated Slip onIncreased Breathable and Comfortable Sports Shoes Walking Casual Shoes,£12.88 - £20.19,NJGRAE,https://m.media-amazon.com/images/I/41EJnDHUzSL.jpg,https://www.amazon.co.uk/dp/B09HJRPV3W,Fashion Trainers,Fashion & Athletic Trainers,Female,35.00%,[SOFT FABRIC UPPER]: Stretch mesh knit upper of these ladies trainers offer a sock-like fit for an optimal fit  Outer Material: Mesh  Inner Material: Unlined  Sole: Thermoplastic Polyurethane  Closure: Pull On  Heel Height: 4 centimetres  Heel Type: Louis Heel  Shoe Width: Wide
BC Footwear Women's Aurora  Pewter  4.5 UK,£41.58,BC Footwear,https://m.media-amazon.com/images/I/41RptjKPmyL.jpg,https://www.amazon.co.uk/dp/B003GBVNTW,Dance Shoes,Sports & Outdoor Shoes,Female,36.00%,Sole: Rubber  Closure: Pull On  Heel Height: 0.12 inches  Shoe Width: Medium
Think! Men's Kong_3-000475 nachhaltige  Leder gefütterte Ankle Boot  7000 Olive Estate  7.5 UK,£193.49,Think!,https://m.media-amazon.com/images/I/318Rc5fQpfL.jpg,https://www.amazon.co.uk/dp/B08VYZ9S9N,Boots,Men's Shoes,Male,38.00%,Outer Material: Leather  Inner Material: Leather Lining  Sole: Rubber  Closure: Zip  Heel Height: 2 centimetres  Heel Type: Block  Shoe Width: Medium
Swimming Diving Outdoor Beach Barefoot Snorkeling Anti-skid Wading Shoes(Size:43 Color:7),£22.71,DATOU,https://m.media-amazon.com/images/I/51ZUZDAgZgL.jpg,https://www.amazon.co.uk/dp/B099NQPL15,Water Shoes,Sports & Outdoor Shoes,Male,30.00%,
adidas Baby Boys' Lite Racer Inf Fitness Shoes Child,£18.00 - £30.06,Visit the adidas Store,https://m.media-amazon.com/images/I/41hIIOn0QhL.jpg,https://www.amazon.co.uk/dp/B07GRHR9JW,First Walking Shoes,Baby Boys,Male,13.00%,Outer Material: Synthetic  Inner Material: Manmade  Sole: Rubber / Synthetic  Closure: Lace-Up  Shoe Width: Medium
Clarks Men's Untilary Pace Oxford,£178.63,Visit the Clarks Store,https://m.media-amazon.com/images/I/41NprviyXaL.jpg,https://www.amazon.co.uk/dp/B00SNJDP3O,Lace-ups,Men's Shoes,Male,31.00%,Outer Material: Mixed  Sole: Rubber  Closure: Lace-Up  Material Composition: Mixed  Shoe Width: Medium
Hi-Tec Women's Wyoming Wp Hiking Boots,£33.95 - £48.87,Hi-Tec,https://m.media-amazon.com/images/I/51+AbD867ML.jpg,https://www.amazon.co.uk/dp/B00BJ6FWRK,Trekking & Hiking Boots,Trekking & Hiking Footwear,Female,16.00%,Outer Material: Leather  Inner Material: Textile  Sole: Rubber  Closure: Lace-Up  Heel Height: 1 centimetres  Heel Type: Flat  Shoe Width: Medium
Bisgaard Unisex - Child Gummistiefel Boots,£21.78 - £41.53,Bisgaard,https://m.media-amazon.com/images/I/4109I8LFdaL.jpg,https://www.amazon.co.uk/dp/B004CRSAI6,Boots,Boys' Shoes,Male,32.00%,Outer Material: Rubber  Inner Material: Cotton  Sole: Rubber  Closure: Pull-On  Heel Height: 1 centimetres  Heel Type: Block  Fit Type: Regular size  Shoe Width: Medium
NIKE Women's Damen Fitnesschuh in-Season-tr 7 Fitness Shoes,£49.99 - £102.45,NIKE,https://m.media-amazon.com/images/I/41FyDiFbwVL.jpg,https://www.amazon.co.uk/dp/B07YKQCSTG,Indoor Court Shoes,Sports & Outdoor Shoes,Female,36.00%,Style#: AR4543-603  Outer Material: Synthetic  Inner Material: Synthetic  Sole: Polyurethane  Closure: Lace-Up  Heel Type: Flat  Shoe Width: Medium
ECCO Helsinki  Men's Derbys,£56.40,Visit the ECCO Store,https://m.media-amazon.com/images/I/41Wxgbd1s6L.jpg,https://www.amazon.co.uk/dp/B0052CQZVE,Lace-ups,Men's Shoes,Male,24.00%,Outer Material: Leather  Inner Material: Textile  Sole: Rubber  Closure: Pull On  Heel Height: 1 centimetres  Heel Type: Block  Shoe Width: normal
New Balance Men's 4040v5 Molded Baseball Shoe  0,£49.42 - £239.17,Visit the New Balance Store,https://m.media-amazon.com/images/I/410WXy1odQL.jpg,https://www.amazon.co.uk/dp/B07HMVNF1F,Baseball Shoes,Sports & Outdoor Shoes,Male,13.00%,Outer Material: Rubber  Sole: Man Made  Closure: Lace-Up  Heel Type: Block  Material Composition: Synthetic  Shoe Width: M
Skechers Men's Superior Milford Loafers,£35.11 - £176.80,Visit the Skechers Store,https://m.media-amazon.com/images/I/41DqbPMhgCL.jpg,https://www.amazon.co.uk/dp/B00M9GKBMA,Espadrilles,Men's Shoes,Male,34.00%,Outer Material: Mix Of Leather And Synthetic Materials  Inner Material: Manmade  Sole: Rubber  Closure: Pull On  Heel Height: 7.5 centimetres  Heel Type: Flat  Shoe Width: Normal
Xu Yuan Jia-Shop Mens Bathroom Shower Slippers Beach Non-Slip Sandal Thick Bottom Open Toe Soft Cushioned Pool Gym House Slippe (Color : Gray  Size : 42-43),£18.11,Xu Yuan Jia-Shop,https://m.media-amazon.com/images/I/51e6FsAk7CS.jpg,https://www.amazon.co.uk/dp/B097R6XNP7,Slippers,Men's Shoes,Male,11.00%,【Anti Slip】Anti Slip: Sole with Corrugated design electing High-Elastic EVA material  has good slip resistance  coupled with the pressure of the human body weight increased friction to keep balance better  especially used in the bath.
Kickers Unisex Junior Kick Hi Black Leather School Shoes with Zip,£35.00 - £64.21,Visit the Kickers Store,https://m.media-amazon.com/images/I/31ReHhqIq6S.jpg,https://www.amazon.co.uk/dp/B07ZW36K88,Boots,Boys' Shoes,Male,18.00%,Outer Material: Leather  Inner Material: Synthetic  Sole: Rubber  Closure: Lace-Up  Heel Type: Flat  Shoe Width: Medium
Skechers Girl Girl Shoes Shimmer Beams-Sporty Glow Blue,£91.92 - £127.28,Visit the Skechers Store,https://m.media-amazon.com/images/I/41PCItki32L.jpg,https://www.amazon.co.uk/dp/B083Z9M9Q8,Fashion Trainers,Fashion & Athletic Trainers,Female,37.00%,Sole: Rubber  Closure: Hook & Loop  Shoe Width: M
PMJAdd8s4 Womens Laides Vintage Wedge Slippers Buckle Decor Round Toe Slip On Shoes,,PMJAdd8s4,https://m.media-amazon.com/images/I/31bXRgWAWlS.jpg,https://www.amazon.co.uk/dp/B097L11WXK,Fashion Sandals,Sandals & Slides,Female,19.00%,Closure: Slip On  Heel Type: Flat  Shoe Width: Wide
Wrangler Women's Olivia Gymnastics Shoes,£35.63 - £85.80,Visit the Wrangler Store,https://m.media-amazon.com/images/I/31mQHdIa7HS.jpg,https://www.amazon.co.uk/dp/B0949NQHYG,Fashion Trainers,Fashion & Athletic Trainers,Female,31.00%,Outer Material: Leather  Inner Material: Canvas  Sole: Rubber  Closure: Lace-Up  Heel Height: 1.5 centimetres  Heel Type: Chunky  Shoe Width: Medium
Rothco 5250 Men'S Black High-Gloss Uniform Oxford Shoe W/Work Sole,£39.24 - £68.13,ROTHCO,https://m.media-amazon.com/images/I/31B9kC4sbuL.jpg,https://www.amazon.co.uk/dp/B00PIUP0AM,,,Male,32.00%,Outer Material: patent leather  Sole: Leather  Ethylene Vinyl Acetate  Closure: lace-up
TOMS Women's Carlo Sneaker,£20.49 - £105.15,Visit the TOMS Store,https://m.media-amazon.com/images/I/31w-O4nH9xS.jpg,https://www.amazon.co.uk/dp/B07G4CTZ43,Fashion Trainers,Fashion & Athletic Trainers,Female,32.00%,Outer Material: Canvas  Inner Material: 100% Cotton  Sole: 60.9 Textile  39.1% Rubber/Plastic  Closure: Lace-Up  Heel Height: 0.75 inches  Heel Type: No Heel  Shoe Width: Medium
Giro Comp Racer Blk M,£17.99,Visit the Giro Store,https://m.media-amazon.com/images/I/31kXB3U5yWL.jpg,https://www.amazon.co.uk/dp/B08HVXRD11,Cycling Shoes,Sports & Outdoor Shoes,Male,40.00%,
Lacoste Men's Menerva Sport 0121 1 CMA Sneaker,£70.00 - £89.95,Visit the Lacoste Store,https://m.media-amazon.com/images/I/41IWhVtv0GL.jpg,https://www.amazon.co.uk/dp/B08PCZT5BY,Fashion Trainers,Fashion & Athletic Trainers,Male,38.00%,Outer Material: Synthetic  Inner Material: Manmade  Sole: Rubber  Closure: Lace-Up  Heel Type: Flat  Shoe Width: Medium
Sebago Men's Docksides Portland Waxed Boat Shoes,£79.99 - £141.00,Sebago,https://m.media-amazon.com/images/I/41Cx3Lq5JtL.jpg,https://www.amazon.co.uk/dp/B07NZ67JQP,Boat & Deck Shoes,Men's Shoes,Male,38.00%,Upper: leather  Lining: Leather  Outer Material: Leather  Inner Material: Leather  Sole: Rubber  Closure: Lace-Up  Heel Height: 1.2 centimetres  Shoe Width: Medium  Sole Material: Rubber  Heel Type: Flat  Closure: lacing  Size: Regular  Upper: other leather  Insole: leather
Under Armour Women's Charged Escape 3 Running Shoes,£56.83 - £242.00,Visit the Under Armour Store,https://m.media-amazon.com/images/I/41BW-9VyXTL.jpg,https://www.amazon.co.uk/dp/B07HKKQXTB,Road Running Shoes,Running Shoes,Female,35.00%,NEUTRAL: For runners who need a balance of flexibility & cushioning  Outer Material: Synthetic  Inner Material: Textile  Sole: Ethylene Vinyl Acetate  Closure: Lace-Up  Heel Type: low-heel  Shoe Width: Medium  Offset: 10mm
ROXY Women's Sheilahh Slip on Platform Sneaker Shoe,£43.73 - £113.50,Roxy,https://m.media-amazon.com/images/I/31RWZTHxMtL.jpg,https://www.amazon.co.uk/dp/B081V1VMZT,Fashion Trainers,Fashion & Athletic Trainers,Female,15.00%,Upper: Textile upper  Outer Material: Canvas  Inner Material: Textile  Sole: Rubber  Closure: Pull On  Heel Type: Platform  Shoe Width: Medium  Outsole: Flexible TPR injected
HROYL Women's Latin Salsa Dance Shoes for Ballroom Performance Practice Dance Heels Model YCL441,£27.99 - £34.99,Visit the HROYL Store,https://m.media-amazon.com/images/I/41EtRr3QnnL.jpg,https://www.amazon.co.uk/dp/B08P4JPDGG,,,Female,15.00%,❤️Outter Material: These latin satin dance shoes are made of satin silk and lace which is very soft & durable.The suede soles are soft and flexible mute and Non-slip.It can not only make dancers dance freely without getting the feet tired but also can better avoid your feet slip caused by the sweaty feet.  ❤️ Design: There are two adjustable buckles on the front  which can fit your feet more comfortable.Exquisite lathes routing  full upper supporting the skeleton  and the shoes are comfortable to wear without hurting the feet.The multiple cross straps not only give your feet better support  but also better decorate your feet shape .  Outer Material: Satin  Inner Material: Manmade  Sole: Leather  Closure: Lace-Up  Heel Height: 5 centimetres  Shoe Width: Normal centimetres  ❤️Free Customization: We can not only make the suede sole but also the rubber sole .If you need to change the sole material or the heel style  please contact with us after you place the order in time  we will customize the shoes according to your requests .  ❤️Scope of Application: Exquisite workmanship flexible and comfortable.Perfect for amateur or professionals for Latin  Salsa  Samba  ChaCha  Rumba Dance practice or performance.Perfect dance shoes  ballroom dance shoes  also match with work outfits  casual jeans  skirts or dresses.  ❤️Size tip: Please measure the length and width of your feet before ordering  and then check our size chart for purchase. For customers with slightly wider feet please select the size one size larger.
Fila Men's V94m Sneaker,£40.29 - £129.99,Fila,https://m.media-amazon.com/images/I/41rR5b3FVUL.jpg,https://www.amazon.co.uk/dp/B07N96CZNC,Fashion Trainers,Fashion & Athletic Trainers,Male,36.00%,Target gender: male  Sole: Rubber  Closure: Lace-Up  Shoe Width: Medium  Package Dimensions: 12.192 L x 32.512 H x 22.86 W (centimeters)
Helly Hansen Men's The Forester Safety Boots,£73.90 - £230.63,Visit the Helly Hansen Store,https://m.media-amazon.com/images/I/41O5FmJkmmL.jpg,https://www.amazon.co.uk/dp/B07SQRN7WY,Trekking & Hiking Footwear,Sports & Outdoor Shoes,Male,17.00%,Outer Material: Leather  Inner Material: Leather  Sole: Synthetic Rubber  Closure: Speed Laces  Heel Type: Platform  Shoe Width: Medium
British Knights Kaya MID Sneaker  Rust  10 UK Child,£35.84,British Knights,https://m.media-amazon.com/images/I/41vWfCBsRDL.jpg,https://www.amazon.co.uk/dp/B096Y62S2L,Fashion Trainers,Fashion & Athletic Trainers,Female,35.00%,INSOLE MATERIAL: COTTON  OUTSOLE MATERIAL: RUBBER  Outer Material: Polyester  Inner Material: Cotton  Sole: Rubber  Closure: Lace-Up  Heel Type: Platform  Shoe Width: Medium  LINING MATERIAL: COTTON  UPPER MATERIAL: POLYESTER
Geox Men's U Timothy D Moccasin,£99.27 - £115.51,Visit the Geox Store,https://m.media-amazon.com/images/I/31O9gLarFEL.jpg,https://www.amazon.co.uk/dp/B08QMCM1ZR,Lace-ups,Men's Shoes,Male,37.00%,Outer Material: Smooth Leather  Inner Material: Canvas  Sole: Rubber  Closure: Zip  Heel Type: No Heel  Shoe Width: Medium
Atlas ESD Sicherheitsschuh SL 9845 XP Boa Blue Width 10 in Accordance with EN ISO 20345 S3 SRC,£141.78 - £183.15,Atlas,https://m.media-amazon.com/images/I/51CdTeq+3xL.jpg,https://www.amazon.co.uk/dp/B00ZFVLFIK,Work & Utility Footwear,Women's Shoes,Female,24.00%,Outer Material: Leather  Closure: Twist Lock  Shoe Width: Medium
ROPER Men's Nash Western Boot,£202.24 - £202.61,ROPER,https://m.media-amazon.com/images/I/41OL478h8SL.jpg,https://www.amazon.co.uk/dp/B07CDMS7W3,Boots,Men's Shoes,Male,18.00%,Outer Material: Leather  Sole: Leather  Closure: Pull-On  Shoe Width: Medium
PUMA Men's Smash Sneaker,£43.76 - £181.85,Visit the PUMA Store,https://m.media-amazon.com/images/I/31GwqjeKp9L.jpg,https://www.amazon.co.uk/dp/B07KX6R9L4,Fashion Trainers,Fashion & Athletic Trainers,Male,33.00%,Sole: Rubber  Closure: Lace-Up  Heel Height: 1 centimetres  Heel Type: No Heel  Shoe Width: M
Skechers Women's Ultra Groove Trainers,£40.31 - £199.90,Visit the Skechers Store,https://m.media-amazon.com/images/I/41K++i7MkEL.jpg,https://www.amazon.co.uk/dp/B07TVF6ZC2,Fashion Trainers,Fashion & Athletic Trainers,Female,15.00%,Upper: Textile  Lining: Textile  Outer Material: Synthetic  Inner Material: Textile  Sole: Ethylene Vinyl Acetate  Closure: Lace-Up  Heel Type: No Heel  Shoe Width: Medium  Sole: EVA  Heel Height: 45  Width: Standard
Primigi Boy's Lab 84195 Sneaker,£50.28 - £51.88,Primigi,https://m.media-amazon.com/images/I/41w2PeQLHNL.jpg,https://www.amazon.co.uk/dp/B08VWFB83Q,Fashion Trainers,Fashion & Athletic Trainers,Male,25.00%,Outer Material: Patent leather  Inner Material: Textile  Sole: Polyurethane  Closure: Hook & Loop  Heel Type: Flat  Shoe Width: Medium
Reebok Women's Flexagon Force 2.0 Cross Trainer,£33.94 - £54.49,Visit the Reebok Store,https://m.media-amazon.com/images/I/31mfbmXQPWL.jpg,https://www.amazon.co.uk/dp/B089NYVSBX,Road Running Shoes,Running Shoes,Female,19.00%,Outer Material: Synthetic  Inner Material: Synthetic  Sole: Rubber  Closure: Lace-Up  Heel Type: Low  Shoe Width: Medium
Sperry Men's Ice Bay Tall Boot  Black  10 UK,£157.99,Sperry,https://m.media-amazon.com/images/I/41ymiqVh3qL.jpg,https://www.amazon.co.uk/dp/B07KQ3QGWB,Boots,Men's Shoes,Male,19.00%,Outer Material: Not Specified  Sole: Rubber  Closure: Lace-Up  Shoe Width: M
YQQMC Water Sports Shoes Barefoot Quick-drying Water Socks For Men And Women Breathable Shoes (Color : Black  Size : 43EU),£23.60,YQQMC,https://m.media-amazon.com/images/I/31hr8AoKL6S.jpg,https://www.amazon.co.uk/dp/B0982QXFLH,Water Shoes,Sports & Outdoor Shoes,Male,20.00%,Recommendation 1: Convenience-The smooth neck design prevents abrasions when wearing water shoes. Easy to put on and take off.  Recommendation 2: Comfortable fit - The upper has good elasticity  breathable and smooth fabric. Flexible and comfortable like socks.  Recommendation 3: Lightweight and portable - The soft fabric and rubber sole can be easily folded  and the water shoes are very convenient for travel and storage.  Recommendation 4: Quick-drying and breathable - This shoe adopts super breathable design. The sole and insole are designed with drainage holes  which can drain water to keep your feet fresh and dry from the inside to the outside.  Recommendation 5: Wearing occasions-yoga training  beach  swimming  pool  weight training  figure-skiing  sailing  boating  kayaking  windsurfing  biking  jogging  walking  fishing  beach volleyball  gardening  lawn   Car washing and driving. Family out!
Lotto Unisex's Strada Vi Jr L Fitness Shoes,£40.06 - £49.96,Lotto,https://m.media-amazon.com/images/I/41235cFP7HL.jpg,https://www.amazon.co.uk/dp/B07K9C5FHD,Indoor Court Shoes,Sports & Outdoor Shoes,Male,19.00%,Outer Material: Synthetic  Inner Material: Manmade  Sole: Synthetic  Closure: Lace-Up  Shoe Width: Medium
Sansha Women's Recital II Pointe Shoe,£33.38 - £42.65,Sansha,https://m.media-amazon.com/images/I/41EckpmXGyL.jpg,https://www.amazon.co.uk/dp/B006SU9D2W,Dance Shoes,Sports & Outdoor Shoes,Female,30.00%,Outer Material: satin  Sole: Leather  Closure: Pull On  Heel Type: No Heel  Shoe Width: B womens_us
"Battle Men Men's Elevator Shoes 2"" Taller Lace up Faux Leather Formal Oxford Dress Footwear Removable Invisible Height Increasing Insole Formal Men",£34.63 - £41.30,Battle Men,https://m.media-amazon.com/images/I/41p44jFOhpL.jpg,https://www.amazon.co.uk/dp/B0785J84R1,Loafers & Moccasins,Men's Shoes,Male,15.00%,Sole: Rubber  Closure: Pull On  Shoe Width: medium
Saucony Kids' Sk162003 Sneaker,£80.04 - £148.93,Saucony,https://m.media-amazon.com/images/I/41zQfTIyMmL.jpg,https://www.amazon.co.uk/dp/B07KKJGFJB,Cross Trainers,Sports & Outdoor Shoes,Male,14.00%,Outer Material: Not Specified  Sole: Rubber  Closure: Lace-Up  Shoe Width: M
CHAMARIPA Men's Oxford Brogue Lace-Up Height Increasing Elevator Shoes 2.56'' Taller DX60B06-1,£141.65 - £152.51,Visit the CHAMARIPA Store,https://m.media-amazon.com/images/I/41m+3Yr4PGL.jpg,https://www.amazon.co.uk/dp/B0122N155G,Lace-ups,Men's Shoes,Male,32.00%,Weight(Pair): 43oz.*Based on 8.5 US.Natural Rubber Outsole.High Wear-Resistant.No Odor. Lightweight Design.Hardness Of 55 Degrees (± Within 5 degrees).  Sole: Rubber  Closure: Lace-Up  Shoe Width: D(M) mens_us
adidas Unisex Kid's Duramo Sl C Running Shoe  2 UK,£24.95 - £62.70,Visit the adidas Store,https://m.media-amazon.com/images/I/318Ykklp9VL.jpg,https://www.amazon.co.uk/dp/B08PVTQ5QK,Road Running Shoes,Running Shoes,Male,20.00%,Outer Material: Canvas  Inner Material: Textile  Sole: Rubber  Closure: Lace-Up  Heel Type: No Heel  Shoe Width: Medium
First Tactical Men's Urban Operator Waterproof Side-Zip,£145.00,First Tactical,https://m.media-amazon.com/images/I/41b9GuvQezL.jpg,https://www.amazon.co.uk/dp/B07VGZ62QP,,,Male,25.00%,Outer Material: Leather  Closure: Zip  Shoe Width: Medium
adidas Women's Falcon W Casual Sneaker,£147.55,Visit the adidas Store,https://m.media-amazon.com/images/I/41iKhqZLcJL.jpg,https://www.amazon.co.uk/dp/B07QMTW44J,Indoor Court Shoes,Sports & Outdoor Shoes,Female,34.00%,Sole: Rubber  Closure: Lace-Up  Heel Height: 3 centimetres  Heel Type: low-heel  Shoe Width: M womens_us
Think! Men's Lait_3-000361 Nachhaltige Wechselfußbett Sneaker,£57.18 - £178.28,Think!,https://m.media-amazon.com/images/I/31IgTrM0rYL.jpg,https://www.amazon.co.uk/dp/B08FRGSNQH,Fashion Trainers,Fashion & Athletic Trainers,Male,27.00%,Outer Material: Velour/smooth leather  Inner Material: Leather Lining  Sole: Light rubber  Closure: Lace-Up  Heel Height: 1.5 centimetres  Heel Type: Flat  Fit Type: Comfortable fit  Shoe Width: Normal
Skechers Men's Go Run 600 - Zexor School Uniform Shoe,£31.21 - £157.64,Visit the Skechers Store,https://m.media-amazon.com/images/I/3151Nzv70HL.jpg,https://www.amazon.co.uk/dp/B07NSPN1G2,,,Male,12.00%,Sole: Synthetic  Closure: Lace-Up  Shoe Width: Medium
adidas Boy's Men's X 17.3 Fg Footbal Shoes Child,£39.99 - £202.85,Visit the adidas Store,https://m.media-amazon.com/images/I/51CwpNGMgbL.jpg,https://www.amazon.co.uk/dp/B01N0Q6PEN,Football Boots,Sports & Outdoor Shoes,Male,32.00%,Outer Material: Synthetic  Inner Material: Manmade  Sole: Ethylene Vinyl Acetate  Closure: Lace-Up  Heel Type: Flat  Shoe Width: Medium
Breathable Children's Sneakers Casual Running Sports Breathable Athletic Lightweight Shoes Sneakers For Girls Princess Fashionable Shoes LED Lights Shoes With LED flash(Size:29 Color:white),£16.84,QBSW,https://m.media-amazon.com/images/I/41HFrjwfYFL.jpg,https://www.amazon.co.uk/dp/B08Z7DFVGL,Sandals,Boys' Shoes,Male,27.00%,🧸：Occasions: outdoor sports  vacation  school  church  travel  walking with dogs  daily wear  etc.
ASICS Men's Gel-Lyte Iii Og Gymnastics Shoe,£73.68 - £105.52,ASICS,https://m.media-amazon.com/images/I/418bNBpkiTL.jpg,https://www.amazon.co.uk/dp/B08PFZLZ6S,Fashion Trainers,Fashion & Athletic Trainers,Male,33.00%,Outer Material: Synthetic  Inner Material: Manmade  Sole: Rubber  Closure: Lace-Up  Heel Type: No Heel  Shoe Width: Medium
Skechers Women's Skech-air Ultra Flex Trainers,£24.99 - £210.23,Visit the Skechers Store,https://m.media-amazon.com/images/I/41Om9AYj5bL.jpg,https://www.amazon.co.uk/dp/B07J6PN9GD,Fashion Trainers,Fashion & Athletic Trainers,Female,25.00%,Outer Material: Synthetic  Inner Material: Textile  Sole: Ethylene Vinyl Acetate  Closure: Lace-Up  Heel Type: Flat  Shoe Width: Medium womens_us
adidas Originals Girls' EQT Support J Running Shoe  Turbo Black/White  6.5 M US Big Kid,£48.28,adidas Originals,https://m.media-amazon.com/images/I/41KGVrVP-aL.jpg,https://www.amazon.co.uk/dp/B01HRE4FRK,Fashion Trainers,Fashion & Athletic Trainers,Female,21.00%,Outer Material: Synthetic  Sole: Rubber  Closure: Lace-Up  Shoe Width: Medium
Vans ERA Trainers Women Pink Low top Trainers,£22.36 - £115.30,Visit the Vans Store,https://m.media-amazon.com/images/I/31LZ-N3eghL.jpg,https://www.amazon.co.uk/dp/B07W91152H,Fashion Trainers,Fashion & Athletic Trainers,Female,18.00%,Outer Material: canvas  Outer Material: textile  Inner Material: Textile  Sole: textile  Closure: Lace-Up  Heel Type: Flat  Shoe Width: Medium  Inner Material: Textile  Shoe Width: Medium
Däumling Boy's Nature Bio-line Sneaker,£16.76 - £61.64,Däumling,https://m.media-amazon.com/images/I/31UuswqoqZL.jpg,https://www.amazon.co.uk/dp/B0873G8F2P,Fashion Trainers,Fashion & Athletic Trainers,Male,13.00%,Outer Material: Smooth Leather  Inner Material: Leather  Sole: Rubber  Closure: Lace-Up  Shoe Width: Medium
Skechers Men's Gander liveoak Sandals,£39.95 - £184.34,Visit the Skechers Store,https://m.media-amazon.com/images/I/41XnalGtS5L.jpg,https://www.amazon.co.uk/dp/B014EBY8W6,Flip Flops & Thongs,Men's Shoes,Male,39.00%,Outer Material: Mixed  Sole: Synthetic  Closure: Hook & Loop  Heel Height: 1.5 inches  Heel Type: Low Heel  Material Composition: Mixed  Shoe Width: Medium
Teva Men's Voya Slide M's Mules,£30.00 - £42.85,Visit the Teva Store,https://m.media-amazon.com/images/I/31JtNl7RhrL.jpg,https://www.amazon.co.uk/dp/B07K4FVR7S,Clogs & Mules,Men's Shoes,Male,11.00%,Outer Material: Synthetic  Inner Material: Unlined  Sole: Ethylene Vinyl Acetate  Closure: Pull On  Heel Type: Flat  Shoe Width: Normal
Däumling Mel Sneaker Child,£57.38,Däumling,https://m.media-amazon.com/images/I/314I-mySRCL.jpg,https://www.amazon.co.uk/dp/B07YP528HP,Fashion Trainers,Fashion & Athletic Trainers,Female,16.00%,Outer Material: Leather  Inner Material: Textile  Sole: Synthetic  Closure: Hook & Loop  Shoe Width: Medium
