title,price,brand,image_link,url,sub_category,category,gender,promotions,metadata_features
PUMA Kids' Spirit Soccer Shoe,£41.57 - £125.73,Visit the PUMA Store,https://m.media-amazon.com/images/I/417GyjH+JfL.jpg,https://www.amazon.co.uk/dp/B077TMFW9Q,Fashion Trainers,Fashion & Athletic Trainers,Male,32.00%,Outer Material: Synthetic  Sole: Rubber  Closure: Lace-Up  Shoe Width: Medium
Pablosky Girl's 496000 Sandal,£25.57 - £37.41,Pablosky,https://m.media-amazon.com/images/I/419abvg9UsL.jpg,https://www.amazon.co.uk/dp/B08HJL4MZ1,Sandals,Girls' Shoes,Female,11.00%,Outer Material: Leather  Sole: Rubber  Closure: Hook & Loop  Shoe Width: Medium
PRIMIGI Girl's Pve 74201 Sandal,£19.26 - £26.37,Primigi,https://m.media-amazon.com/images/I/41wz0ZMJ5FL.jpg,https://www.amazon.co.uk/dp/B08FBHC2CM,Sandals,Girls' Shoes,Female,14.00%,Fabric type: 100% leather  Outer Material: Leather  Inner Material: Synthetic  Sole: Rubber  Closure: Hook & Loop  Heel Type: No Heel  Shoe Width: Medium  Brand: Primigi  Country of origin: CN
Grinders Louisiana Black Mens Cowboy Boots,£114.30 - £120.00,Visit the Grinders Store,https://m.media-amazon.com/images/I/31oA7E79GpL.jpg,https://www.amazon.co.uk/dp/B006BUTPM2,Boots,Men's Shoes,Male,40.00%,Outer Material: Leather  Closure: Pull-On  Heel Height: 1 centimetres  Shoe Width: Medium
New Rock Men's 236-S1 Boot,£185.46,New Rock,https://m.media-amazon.com/images/I/41tAwcwfeaL.jpg,https://www.amazon.co.uk/dp/B003B3N79O,Boots,Men's Shoes,Male,22.00%,Outer Material: Leather  Inner Material: Fabric  Sole: Rubber  Closure: Side Zip  Heel Height: 7.5 inches  Heel Type: NORMAL  Material Composition: Leather shoes  Shoe Width: Medium
Patrizia Pepe Kids Girl's Ppj66 Sneaker,£37.65 - £43.19,Patrizia Pepe Kids,https://m.media-amazon.com/images/I/41RGKFwrfqL.jpg,https://www.amazon.co.uk/dp/B08P4Q41P5,Fashion Trainers,Fashion & Athletic Trainers,Female,26.00%,Outer Material: Smooth Leather  Inner Material: Manmade  Sole: Polyurethane  Closure: Pull On  Heel Type: Flat  Shoe Width: Medium
adidas Men's Adizero Pro M Running Shoe,£89.99 - £259.84,Visit the adidas Store,https://m.media-amazon.com/images/I/311khtILwaS.jpg,https://www.amazon.co.uk/dp/B08Q4BV2RH,Road Running Shoes,Running Shoes,Male,32.00%,Outer Material: Synthetic  Inner Material: Manmade  Sole: Rubber  Closure: Lace-Up  Heel Type: No Heel  Shoe Width: Medium
Pablosky Girl's 486600 Open Toe Sandals,£15.41 - £34.45,Pablosky,https://m.media-amazon.com/images/I/31RkbRtA0pL.jpg,https://www.amazon.co.uk/dp/B07WZV4V9Q,Sandals,Girls' Shoes,Female,15.00%,Outer Material: Leather  Inner Material: Textile  Sole: Synthetic  Closure: Hook & Loop
Blue Lemon Girl's Mary Jane Sandal with Little Bow,£18.53 - £23.99,Blue Lemon,https://m.media-amazon.com/images/I/41O1UBzbcgL.jpg,https://www.amazon.co.uk/dp/B07HQ2MBHQ,Mary Janes,Girls' Shoes,Female,27.00%,Heel height: approx. 1-inch  Outer Material: Manmade  Closure: Buckle
ASICS Women's Gel-ds Trainer 26 Running Shoe,£111.64 - £141.25,ASICS,https://m.media-amazon.com/images/I/41-E5eVPbbS.jpg,https://www.amazon.co.uk/dp/B08PBFGHGH,Road Running Shoes,Running Shoes,Female,10.00%,Outer Material: Synthetic  Inner Material: Manmade  Sole: Rubber  Closure: Lace-Up  Heel Type: No Heel  Shoe Width: Medium
Pikolinos Leather Casual lace-ups Navas M7T,£47.00 - £103.50,Visit the Pikolinos Store,https://m.media-amazon.com/images/I/31xbSbi4DdS.jpg,https://www.amazon.co.uk/dp/B08HS2KRDW,Lace-ups,Men's Shoes,Male,22.00%,Outer Material: 100% CALFSKIN LEATHER  Inner Material: Leather  Sole: 100% SYNTHETIC  Closure: Lace-Up  Heel Height: 3 centimetres  Heel Type: Flat  Shoe Width: Medium
Merrell Women's  Zion Mid Waterproof Hiking Shoe,£87.71,Visit the Merrell Store,https://m.media-amazon.com/images/I/41QnhcCF1DS.jpg,https://www.amazon.co.uk/dp/B07MY9PMFL,Trekking & Hiking Footwear,Sports & Outdoor Shoes,Male,19.00%,Outer Material: Leather  Sole: Rubber  Closure: Lace-Up  Heel Type: Block  Shoe Width: M mens_us
Covalliero Dress Boots,£22.18 - £32.39,Covalliero,https://m.media-amazon.com/images/I/41unFO32WqL.jpg,https://www.amazon.co.uk/dp/B019PE0FP6,Long Riding Boots,Equestrian Boots,Male,35.00%,Outer Material: Synthetic  Closure: Slip-On  Shoe Width: Medium
NIKE Men's Benassi JDI Print Slide Sandal,£26.64 - £51.30,NIKE,https://m.media-amazon.com/images/I/31IbEKV9B1L.jpg,https://www.amazon.co.uk/dp/B08CVQN3NM,Beach Flip Flops & Pool Slides,Sports & Outdoor Shoes,Male,32.00%,Outer Material: Synthetic  Inner Material: Synthetic  Sole: Synthetic Rubber  Closure: Slip On  Shoe Width: Medium
MARCO TOZZI Women's Earth Edition 2-2-23773-25 Sneaker,£28.84 - £64.15,Marco Tozzi,https://m.media-amazon.com/images/I/41HodqF691L.jpg,https://www.amazon.co.uk/dp/B084CMDS4X,Fashion Trainers,Fashion & Athletic Trainers,Female,40.00%,Outer Material: Synthetic  Inner Material: Textile  Sole: Ethylene Vinyl Acetate  Closure: Schnellschnürung  Heel Height: 4 centimetres  Heel Type: no paragraph  Shoe Width: Normal
Skechers Women's Ez Flex 3.0 - Songful Slip On Trainers,£98.43,Visit the Skechers Store,https://m.media-amazon.com/images/I/515Odjyg6ZL.jpg,https://www.amazon.co.uk/dp/B0791LVJ14,Fashion Trainers,Fashion & Athletic Trainers,Female,20.00%,Outer Material: Leather  Sole: Leather  Closure: Pull On  Heel Type: low-heel  Shoe Width: medium
GBZLFH Women Chunky Sneakers  Fashion Artificial PU Wedge Walking Shoes Summer Breathable Platform Lace-up Sneakers,,GBZLFH,https://m.media-amazon.com/images/I/41CQ5t8KftL.jpg,https://www.amazon.co.uk/dp/B08YYGBP45,Fashion Trainers,Fashion & Athletic Trainers,Female,30.00%,03Inner material: breathable mesh  comfortable  04 Sole: non-slip wear-resistant sole  05 heel height: 7 cm
Chicco Girl's Sandalo Mattia Sandal,£13.74 - £25.50,chicco,https://m.media-amazon.com/images/I/315xb96yKcL.jpg,https://www.amazon.co.uk/dp/B085VLQNJV,Sandals,Girls' Shoes,Female,18.00%,Outer Material: Synthetic  Inner Material: Manmade  Sole: Polyvinyl Chloride  Closure: Velcro  Shoe Width: Medium
Pablosky Girl's 848705 Closed Toe Ballet Flats,£10.75,Pablosky,https://m.media-amazon.com/images/I/31ur7mrLeSL.jpg,https://www.amazon.co.uk/dp/B07X723M4D,Ballet Flats,Girls' Shoes,Female,34.00%,Outer Material: Leather  Inner Material: Textile  Sole: Synthetic  Closure: Pull On  Shoe Width: Medium
ASICS Unisex's Jolt 2 Gs Running Shoe  2 UK,£25.41,ASICS,https://m.media-amazon.com/images/I/411vR1O2uBL.jpg,https://www.amazon.co.uk/dp/B088Y87XWT,Cross Trainers,Sports & Outdoor Shoes,Male,21.00%,Outer Material: Synthetic  Inner Material: Synthetic  Sole: Synthetic  Closure: Lace-Up  Shoe Width: Medium
K-Swiss Women's Court Pro Curves Sneaker,£51.19 - £59.18,K-Swiss,https://m.media-amazon.com/images/I/31VWt4uRmeS.jpg,https://www.amazon.co.uk/dp/B08P35ZH5B,Fashion Trainers,Fashion & Athletic Trainers,Female,10.00%,Sole: Rubber  Closure: Lace-Up  Heel Type: No Heel  Shoe Width: Medium
s.Oliver Women's 5-5-24205-36 Sneaker,£20.52 - £58.35,Visit the s.Oliver Store,https://m.media-amazon.com/images/I/415ccF3FZ2L.jpg,https://www.amazon.co.uk/dp/B08HDFG721,Fashion Trainers,Fashion & Athletic Trainers,Female,28.00%,Outer Material: Synthetic  Inner Material: Textile  Sole: Ethylene Vinyl Acetate  Closure: slipper  Heel Type: No paragraph  Shoe Width: Medium
ASICS Women's Gt-1000 7 Running Shoes,£91.36 - £227.45,ASICS,https://m.media-amazon.com/images/I/418ACs+in2L.jpg,https://www.amazon.co.uk/dp/B077MQ5X78,,,Female,19.00%,Outer Material: Synthetic  Sole: Rubber  Closure: Lace-Up  Heel Type: No Heel  Shoe Width: Medium
Vans Milton  Women's Sneakers,£54.67,Visit the Vans Store,https://m.media-amazon.com/images/I/41UmdpD3ZIL.jpg,https://www.amazon.co.uk/dp/B00K5OLZ6Y,Fashion Trainers,Fashion & Athletic Trainers,Female,21.00%,Outer Material: Leather  Inner Material: Shearling  Sole: Rubber  Closure: Lace-Up  Heel Height: 2 centimetres  Heel Type: Flat  Shoe Width: Normal
NIKE Men's CV5708-010_44 5 Sports Shoes  Black  11.5 UK,£105.12,NIKE,https://m.media-amazon.com/images/I/41eaIrb7UqL.jpg,https://www.amazon.co.uk/dp/B08ZHDHCTC,Sports & Outdoor Sandals,Sports & Outdoor Shoes,Male,39.00%,Outer Material: Synthetic  Inner Material: Synthetic  Sole: Synthetic  Closure: Lace-Up  Heel Type: Platform  Shoe Width: Medium
ASICS - Unisex-Child Gt-1000 9 Ts Sneaker,£46.51 - £214.95,ASICS,https://m.media-amazon.com/images/I/41ySpHXWc1L.jpg,https://www.amazon.co.uk/dp/B07SPWMRXX,Road Running Shoes,Running Shoes,Female,17.00%,Outer Material: Synthetic  Sole: Ethylene Vinyl Acetate  Closure: Lace-Up  Shoe Width: Medium
Converse All Star Ox Trainers Black,,Converse,https://m.media-amazon.com/images/I/41XWXMv7Y6L.jpg,https://www.amazon.co.uk/dp/B00E0WNSLW,Fashion Trainers,Fashion & Athletic Trainers,Female,18.00%,"Color: Black  Closure: Lace-Up  Heel Type: Low  Shoe Width: Medium  Material: Canvas  Measurements: 1"" heel"
AMY-XCQ U-Ltraman Children's Slippers  Summer Cartoon  Big Children's Indoor Bath  Non-Slip Soft Bottom Lightweight And Comfortable Boys Sandals And Slippers A 33,£15.75,AMY-XCQ,https://m.media-amazon.com/images/I/5167fyDiBsL.jpg,https://www.amazon.co.uk/dp/B09BN4RC41,Slippers,Boys' Shoes,Male,29.00%,
Outdoor Boots  Wellies for Men  PVC  Walking Hunting Farming  Fashionable Design  Outdoor Heavy-Duty Boots  Wellington Boots for Rainy Weather,£18.99,Demara,https://m.media-amazon.com/images/I/31ryUYT4BCL.jpg,https://www.amazon.co.uk/dp/B08Y73XPP1,Boots,Men's Shoes,Male,39.00%,
Skechers Men's Melson Volgo Sneaker,£43.25 - £185.29,Visit the Skechers Store,https://m.media-amazon.com/images/I/41RqiHnNdrL.jpg,https://www.amazon.co.uk/dp/B07TN32R6B,Fashion Trainers,Fashion & Athletic Trainers,Male,17.00%,Outer Material: Canvas  Sole: Rubber  Closure: Pull On  Heel Type: Flat  Shoe Width: Wide
Lottusse Men's L7152 Blucher,£135.36 - £8 241.30,Lottusse,https://m.media-amazon.com/images/I/31+gtHertAL.jpg,https://www.amazon.co.uk/dp/B0862R98P8,Lace-ups,Men's Shoes,Male,27.00%,Outer Material: Leather  Inner Material: Fur  Sole: Rubber  Closure: Lace-Up  Shoe Width: Medium
Cycling Overshoes Waterproof Windproof Fleece Lined MTB Road Warm Bike Shoes Covers Bicycle Winter Thermal Protector(Black  S) Outdoor Equipment,£14.47,sevenjuly,https://m.media-amazon.com/images/I/31CQq4ld71L.jpg,https://www.amazon.co.uk/dp/B091HRVKT7,Cycling Shoes,Sports & Outdoor Shoes,Male,15.00%,REFLECTIVE PORTION: There is a reflective material that can improve night cycling safety.  WINDPROOF & THERMAL: The windproof outer and thermal lining material keep your warm in winter. It is possible for you to use even on rainy or snowy days.  DURABILITY: The soles of the shoes are made of wear-resistant kevlar fabric  durable for long-time wearing.  WATERPROOF: Waterproof design can easily handle different weather. And the waterproof zipper enhances the waterproof function of the shoe cover.  EASY TO USE: The magic tape fastener makes them easy to pull on. High elastic PU rubber ensures a good fit and complete protection.
Brooks Men's Glycerin Gts 19 Running Shoe,£99.95 - £291.43,Brooks,https://m.media-amazon.com/images/I/41XVCCVJPhL.jpg,https://www.amazon.co.uk/dp/B08LMRCWKV,Road Running Shoes,Running Shoes,Male,14.00%,THIS MEN'S SHOE IS FOR: Brooks Transcend 7  GREAT SUPPORT: the knees.  Outer Material: Mesh  Sole: Rubber  Closure: Lace-Up  Heel Height: 1 inches  Heel Type: low-heel  Shoe Width: Medium  MAXIMUM CUSHION AND SUPPORT: Provides maximum support while offering the maximum amount of cushioning. Ideal for road running  cross training  the gym or wherever you might want to take them!  SUPER-SOFT CUSHIONING: The ultimate in softness and supreme comfort  designed for runners who want pillowy soft cushioning. The Glycerin 19 with DNA LOFT offers our most plush underfoot experience yet — so runners enjoy comfort that goes the distance.  SMOOTH TRANSITIONS: The plush transition zone makes every move from heel to toe feel incredibly soft and smooth.
Reef Women's Cushion Sunset Sneaker,£54.34,Visit the Reef Store,https://m.media-amazon.com/images/I/41oP6sdiLxS.jpg,https://www.amazon.co.uk/dp/B08BG4JL1J,Fashion Trainers,Fashion & Athletic Trainers,Female,36.00%,Outer Material: Canvas  Inner Material: Manmade  Sole: Synthetic  Closure: Pull On  Shoe Width: Medium
Tom Tailor Boys 7970602 Classic Boots  Black (Black 00001)  14 UK,£44.19,TOM TAILOR,https://m.media-amazon.com/images/I/41aKYRXBKeL.jpg,https://www.amazon.co.uk/dp/B07NPBQJMP,Boots,Boys' Shoes,Male,32.00%,Outer Material: Synthetic  Inner Material: Textile  Sole: Rubber  Closure: Lace-Up  Heel Type: Flat  Shoe Width: Medium
Converse Women's Chuck Taylor All Star Punk Strap Hi-Top Trainers,£44.99 - £162.50,Converse,https://m.media-amazon.com/images/I/41Z4UZc4nKL.jpg,https://www.amazon.co.uk/dp/B07BTJ829G,Fashion Trainers,Fashion & Athletic Trainers,Female,36.00%,Outer Material: Canvas  Inner Material: Unlined  Sole: Rubber  Closure: Lace-Up  Heel Type: Flat  Shoe Width: Medium
PingYou Men Women Beach Shoes Quick Drying Water Shoes Couple Breathable Slip On,,PingYou,https://m.media-amazon.com/images/I/41POnuLvB-L.jpg,https://www.amazon.co.uk/dp/B0748HHYWK,Water Shoes,Sports & Outdoor Shoes,Male,20.00%,Fabric: spandex fabric  comfortable  breathable  quick-drying  soft  flexible  a perfect close to the skin.  Delivery Plan: use the Royal Post 4-8 days to Arrive  Outer Material: Spandex fabric  Sole: Spandex fabric Rubber EVA vinyl acetate soles  Closure: Slip-On  Heel Type: Flat  Shoe Width: Medium  Sole: rubber wear-resistant  non-slip design  shoe specially designed drainage holes.  Insole: EVA vinyl acetate soles  breathable high elastic comfortable  absorbent  quick-drying.  Toe: Anti-collision design to protect the fragile feet
Reebok Chaussures enfant Royal Jogger 3,£25.17,Visit the Reebok Store,https://m.media-amazon.com/images/I/41vcg6ZJy+S.jpg,https://www.amazon.co.uk/dp/B096FZW5PV,Fashion Trainers,Fashion & Athletic Trainers,Male,10.00%,
New Balance Women's Impulse V1 FuelCell Running Shoe,,Visit the New Balance Store,https://m.media-amazon.com/images/I/41vGdmny-gL.jpg,https://www.amazon.co.uk/dp/B075R726X5,Road Running Shoes,Running Shoes,Female,38.00%,Sole: Rubber  Closure: Lace-Up  Material Composition: 100 % Synthetic  Shoe Width: Wide
PUMA Women's Basket Satin En Pointe Wn Sneaker,£51.88 - £138.52,Visit the PUMA Store,https://m.media-amazon.com/images/I/4103v66VKHL.jpg,https://www.amazon.co.uk/dp/B0721JCDQ2,Fashion Trainers,Fashion & Athletic Trainers,Female,36.00%,Outer Material: Synthetic  Sole: Rubber  Closure: Lace-Up  Heel Height: 1 centimetres  Heel Type: Flat  Shoe Width: Medium
Under Armour Women's Ua W Charged Pivot Mid CNVS Training Shoes,£35.00 - £225.84,Visit the Under Armour Store,https://m.media-amazon.com/images/I/41WX5UGJ+SL.jpg,https://www.amazon.co.uk/dp/B072J3Y14F,Fashion Trainers,Fashion & Athletic Trainers,Female,11.00%,Outer Material: Canvas  Sole: Rubber  Closure: Lace-Up  Heel Type: Low  Shoe Width: Medium
Johnston & Murphy Men's Melton Cap Toe | Formal Dress Shoe,£185.83 - £212.44,Johnston & Murphy,https://m.media-amazon.com/images/I/41ILd9JjUIL.jpg,https://www.amazon.co.uk/dp/B000UUEPU6,Boots,Men's Shoes,Male,35.00%,Outer Material: Leather  Sole: Leather  Closure: Lace-Up  Heel Height: 1.25 inches  Shoe Width: Medium
Alexis Leroy Men's Canvas Slip on Flat Espadrilles,£16.58 - £20.99,Visit the Alexis Leroy Store,https://m.media-amazon.com/images/I/41gn7OIMaXL.jpg,https://www.amazon.co.uk/dp/B0828V6MJX,Espadrilles,Men's Shoes,Male,31.00%,Outer Material: Synthetic  Inner Material: Textile  Sole: Rubber  Closure: Pull On  Heel Height: 2 centimetres  Heel Type: Flat  Shoe Width: Medium
Fairy Tail Anime Canvas Sneaker Lace Up Sneakers Casual Canvas Shoes Unisex Couple Trainers Ankle Short Boots High Top Student Sports Shoes Lightweight Breathable Flat Outdoor Shoes Size 5.5 UK,£34.82,M.YAN,https://m.media-amazon.com/images/I/513uYeSeNZL.jpg,https://www.amazon.co.uk/dp/B08XZLDTBB,Fashion Trainers,Fashion & Athletic Trainers,Female,10.00%,Outer Material: Canvas  Closure: Lace-Up  Shoe Width: Medium  Occasions: Perfect for everyday  leisure  holidays  party  work  sports & outdoor.
TBS Girl's Entasia Sneaker,£22.13 - £35.03,TBS,https://m.media-amazon.com/images/I/41b+6LJiPnL.jpg,https://www.amazon.co.uk/dp/B08CKPZNG6,Fashion Trainers,Fashion & Athletic Trainers,Female,33.00%,Outer Material: Nubuck Leather  Inner Material: Canvas  Sole: Rubber  Closure: Lace-Up  Shoe Width: Medium
PUMA Men's Basket Classic Xxi Sneaker,£22.70 - £77.69,Visit the PUMA Store,https://m.media-amazon.com/images/I/31Ql7jCoCfL.jpg,https://www.amazon.co.uk/dp/B08MTJPXF3,Fashion Trainers,Fashion & Athletic Trainers,Male,10.00%,Outer Material: Smooth Leather  Inner Material: Synthetic  Sole: Rubber  Closure: Lace-Up  Heel Type: SHOES  Flat  Shoe Width: Medium
PATRIZIA PEPE Girls PPJ507 Sneaker  Black  1 UK,£15.08,PATRIZIA PEPE,https://m.media-amazon.com/images/I/41i4RXWEGLL.jpg,https://www.amazon.co.uk/dp/B089WZSWX1,Fashion Trainers,Fashion & Athletic Trainers,Female,29.00%,Outer Material: smooth_Leather  Inner Material: Leather  Sole: Synthetic  Closure: Zip  Heel Type: Flat  Shoe Width: Medium
Bikkembergs B4BKW0114 Low Women Size: 7 UK,£67.00,Bikkembergs,https://m.media-amazon.com/images/I/31xakj10R5L.jpg,https://www.amazon.co.uk/dp/B08BG87G5H,Fashion Trainers,Fashion & Athletic Trainers,Female,13.00%,Outer Material: Fabric  Closure: Lace-Up  Heel Height: 1 centimetres  Heel Type: Low  Material Composition: 100% fabric  Shoe Width: Normale
adidas NMD_r1 J Big Kids Eh3200,£92.87 - £233.00,Visit the adidas Store,https://m.media-amazon.com/images/I/41asthy3oXL.jpg,https://www.amazon.co.uk/dp/B07V5PPB1H,Fashion Trainers,Fashion & Athletic Trainers,Male,16.00%,Style#: EH3200  Outer Material: mesh  Knit  Synthetic  Closure: Lace-Up  Shoe Width: Medium
Chetto Boys 153984 Sneaker  Azul  8 UK,£49.98,Chetto,https://m.media-amazon.com/images/I/41VqVkTUjNL.jpg,https://www.amazon.co.uk/dp/B08BJ88ZWG,Fashion Trainers,Fashion & Athletic Trainers,Male,36.00%,Outer Material: smooth_leather  Inner Material: Leather  Sole: Leather  Closure: Pull On  Shoe Width: Medium
Adidas Women's Run Lux Clima W,£62.18 - £176.00,Visit the adidas Store,https://m.media-amazon.com/images/I/41UIeO5VgDL.jpg,https://www.amazon.co.uk/dp/B072FHP1GG,Road Running Shoes,Running Shoes,Female,10.00%,Outer Material: Mesh  Sole: Rubber  Closure: Lace-Up  Heel Type: No Heel  Shoe Width: B(M)
Trussardi Jeans Women's Scarpe Da Ginnastica Oxford Flat,£72.48 - £105.45,Trussardi Jeans,https://m.media-amazon.com/images/I/41rS5MmboaL.jpg,https://www.amazon.co.uk/dp/B08CBG5XRW,Fashion Trainers,Fashion & Athletic Trainers,Female,16.00%,Outer Material: Synthetic  Inner Material: Manmade  Sole: Rubber  Closure: Lace-Up  Shoe Width: Medium
Vans M Kress  Men's Low-Top Trainers,£37.86 - £56.24,Visit the Vans Store,https://m.media-amazon.com/images/I/41-eoTOy6yL.jpg,https://www.amazon.co.uk/dp/B00FXL2R5C,,,Male,29.00%,Outer Material: Canvas  Inner Material: Textile  Sole: Rubber  Closure: Lace-Up  Shoe Width: Medium
Amblers Safety Unisex Black Waterproof Safety Boot,£42.73 - £73.98,Amblers Safety,https://m.media-amazon.com/images/I/41FwN9hVixL.jpg,https://www.amazon.co.uk/dp/B00BUO463M,Work & Utility Footwear,Men's Shoes,Male,22.00%,Outer Material: Leather/Textile  Inner Material: Textile  Sole: Manmade  Closure: Lace-Up  Heel Height: 4 centimetres  Shoe Width: Medium
mys Boys’ Chuck Taylor Hi-Top Slippers,£101.79,mys,https://m.media-amazon.com/images/I/41vq1dzJyhL.jpg,https://www.amazon.co.uk/dp/B01N7S2WKG,Fashion Trainers,Fashion & Athletic Trainers,Male,16.00%,Outer Material: Other Textile  Inner Material: Unlined  Closure: Lace-Up  Material Composition: Textile  Shoe Width: Medium
Tama TMA 8818 Women's Fashion Low Shoes Real Leather White 36-42,£45.66 - £50.52,Tama,https://m.media-amazon.com/images/I/51x3pQk5VWL.jpg,https://www.amazon.co.uk/dp/B07VLGZBVH,Boots,Women's Shoes,Female,10.00%,Outer Material: Smooth Leather  Inner Material: Leather  Sole: Rubber  Closure: Lace-Up  Heel Height: 3 centimetres  Heel Type: Block  Material Composition: 100 % Genuine Leather  Shoe Width: normal
adidas Women's Grand Court Shoes Tennis,£40.01 - £192.45,Visit the adidas Store,https://m.media-amazon.com/images/I/31XgZJo7CaL.jpg,https://www.amazon.co.uk/dp/B07D9MBYCK,Tennis Shoes,Sports & Outdoor Shoes,Female,31.00%,Outer Material: leather/synthetic upper  Sole: Rubber  Closure: Lace-Up  Heel Height: 6 inches  Heel Type: No Heel  Shoe Width: M
Geox Boys’ J BULLER B ABX J049WB0ME50 Rain Shoe,£34.99 - £65.76,Visit the Geox Store,https://m.media-amazon.com/images/I/414Xdti0vPL.jpg,https://www.amazon.co.uk/dp/B0825PWD9M,Boots,Boys' Shoes,Male,21.00%,Outer material: synthetic  Inner material: synthetic  Outer Material: Synthetic  Inner Material: Synthetic  Sole: Rubber  Closure: strap  Fit Type: Geox shoes have a comfortable fit  Shoe Width: Schmal  Sole: rubber
Fashion Men Sneakers  All-Match Classic Breathable Casual Women Walking Shoes Couple Shoes (Color : 12  Size : 45),£117.56,CCAN,https://m.media-amazon.com/images/I/41Xt3pnEWdL.jpg,https://www.amazon.co.uk/dp/B094X8FVNL,Fashion Trainers,Fashion & Athletic Trainers,Male,31.00%,
Men Chef Kitchen Shoes with Composite Toe Cap Women Safety Work Non Slip Resistant Clog,£33.00,cdsnxore,https://m.media-amazon.com/images/I/31X63TFaO3L.jpg,https://www.amazon.co.uk/dp/B07GB7RSM8,Work & Utility Footwear,Men's Shoes,Male,12.00%,Outer Material: Nubuck Leather  Sole: Ethylene Vinyl Acetate  Leather  Shoe Width: Medium
Garofalo Gianbattista Men's stringato Lace-Up Flats Dark Blue,£145.22,Garofalo Gianbattista,https://m.media-amazon.com/images/I/31TQcW+BvXL.jpg,https://www.amazon.co.uk/dp/B07HDG2XDD,Lace-ups,Men's Shoes,Male,29.00%,Outer Material: Velvet  Inner Material: Leather  Sole: Leather  Closure: Lace-Up  Heel Height: 25 millimetres  Shoe Width: Medium
Kids Sandals Boys Outdoor Hiking Sports Sandal Girls Pool Beach Shoes Walking Shoes Childrens Summer Sneakers，3.5 UK  A6 Bl Ack Grey,£18.69,ELAPHURUS,https://m.media-amazon.com/images/I/51+zkquVyXS.jpg,https://www.amazon.co.uk/dp/B08W1YJLVQ,Sports & Outdoor Sandals,Sports & Outdoor Shoes,Male,16.00%,Outer material: The lightweight and water-friendly outer material  the quick-drying  breathable lining treatment allows your child's feet to breathe more thoroughly  really experiences the natural  cool and comfortable  Inner material: Easy for children to put on and take off with Velcro fastener  more comfortable  and faster to wear. Energy style and 3 colours to choose from. Let children enjoy their colourful childhood.  Outer Material: Synthetic  Inner Material: Mesh  Sole: Rubber  Closure: Velcro  Heel Height: 2 centimetres  Heel Type: Flat  Shoe Width: Normal  Sole: With multi texture and non-marking rubber outsole  the sandal is durable  non-slip  increased traction and durability.  Outer material: breathable mesh and high-quality PU  which provides high-strength protection and support for children's feet. The children's summer sandals evaporate sweat quickly and keep your feet dry.  Lining: Mesh synthetic fibre  breathable  thin  quick-drying
Art Unisex's Breathe Open Toe Sandals,£23.03 - £76.51,Art,https://m.media-amazon.com/images/I/31lljgdl7UL.jpg,https://www.amazon.co.uk/dp/B07VPW9KBL,Sandals & Slides,Women's Shoes,Female,34.00%,Outer material: leather  Coating: leather  Outer Material: Leather  Inner Material: Synthetic Fur  Sole: Bast  Closure: Buckle  Heel Type: Flat  Shoe Width: Medium  Sole material: rubber  Fastening: Velcro  Heel Type: Flat with
adidas Performance Vengeful W Running Shoes for Women  Grey (Medium Grey/Metallic/Silver/Light Grey),£175.93,Visit the adidas Store,https://m.media-amazon.com/images/I/41TVgvTcWNL.jpg,https://www.amazon.co.uk/dp/B01H6A8D28,Road Running Shoes,Running Shoes,Female,27.00%,Sole: Rubber  Closure: Lace-Up  Heel Type: No Heel  Shoe Width: B womens_us
Jamron Women's Goth Punk High/Low Top Platform Chunky Trainers Lace Up Wedgel Heel Sneakers,£41.90,Jamron,https://m.media-amazon.com/images/I/412Qlu7c20L.jpg,https://www.amazon.co.uk/dp/B0827KK3MZ,Fashion Trainers,Fashion & Athletic Trainers,Female,22.00%,Outer Material: Microfiber Leather  Inner Material: Cotton Mesh  Sole: Polyurethane  Closure: Lace-Up + Velcro Strap  Heel Height: 9 centimetres  Heel Type: Wedge  Shoe Width: Normal
ASICS - Mens Gt-1000 7 (2E) Shoes,£92.45 - £265.96,ASICS,https://m.media-amazon.com/images/I/4162BVldQCL.jpg,https://www.amazon.co.uk/dp/B077MPYJF3,Road Running Shoes,Running Shoes,Male,21.00%,Outer Material: Synthetic  Sole: Rubber  Closure: Lace-Up  Shoe Width: Medium
ASICS Men's Gel-Pulse 10 G-tx Running Shoes  15 UK,£49.99 - £242.00,ASICS,https://m.media-amazon.com/images/I/417ZY+23K0L.jpg,https://www.amazon.co.uk/dp/B07KXXXJXY,Road Running Shoes,Running Shoes,Male,21.00%,Outer Material: Synthetic  Sole: Rubber  Closure: Lace-Up  Heel Type: No Heel  Shoe Width: Medium
Reebok Men's Royal Bb4500 Hi2 Sneakers,£56.05 - £181.13,Visit the Reebok Store,https://m.media-amazon.com/images/I/410gA7TXx9L.jpg,https://www.amazon.co.uk/dp/B077ZGY9P2,Fashion Trainers,Fashion & Athletic Trainers,Male,27.00%,Sole: Rubber  Closure: Lace-Up  Shoe Width: Medium
Columbia Men's 100mw Titanium Outdry Walking Shoe,£142.08 - £277.93,Columbia,https://m.media-amazon.com/images/I/41wDCZ7tD-L.jpg,https://www.amazon.co.uk/dp/B07VKQDG8C,Trail Running Shoes,Running Shoes,Male,17.00%,Outer Material: Leather  Inner Material: Synthetic  Sole: Rubber  Closure: Lace-Up  Heel Type: Flat  Shoe Width: Medium
PUMA Women's Carson 2 Sneaker  Medium,£44.78 - £130.01,Visit the PUMA Store,https://m.media-amazon.com/images/I/4182CrQzA1L.jpg,https://www.amazon.co.uk/dp/B07TNX3GM5,Fashion Trainers,Fashion & Athletic Trainers,Female,31.00%,Outer Material: Synthetic  Sole: Rubber  Closure: Lace-Up  Heel Type: Flat  Shoe Width: Medium
