title,price,brand,image_link,url,sub_category,category,gender,promotions,metadata_features
adidas Womens Pod-S3.1 Lace Up Sneakers Shoes Casual - Green,£71.16 - £162.50,Visit the adidas Store,https://m.media-amazon.com/images/I/4165yLM4YgL.jpg,https://www.amazon.co.uk/dp/B07JPZCGKG,Fashion Trainers,Fashion & Athletic Trainers,Female,36.00%,Sole: Ethylene Vinyl Acetate  Closure: Lace-Up  Heel Height: 2 centimetres  Heel Type: low-heel  Shoe Width: MEDIUM
UGG Men's Pismo Sneaker Low Perf,£41.12 - £112.52,Visit the UGG Store,https://m.media-amazon.com/images/I/31DrN7AAcGL.jpg,https://www.amazon.co.uk/dp/B089NZ5W89,Fashion Trainers,Fashion & Athletic Trainers,Male,30.00%,"Outer Material: Cow Leather  Inner Material: Synthetic  Sole: Ethylene Vinyl Acetate  Closure: Lace-Up  Heel Height: 1 1/4"" inches  Heel Type: Flat  Shoe Width: Medium"
ZAPATILLA ASICS D747N-9090 Tiger Corsair Size: 6 UK,£38.09,Onitsuka Tiger,https://m.media-amazon.com/images/I/41Ib80rpQxL.jpg,https://www.amazon.co.uk/dp/B06ZXZ4HP5,Fashion Trainers,Fashion & Athletic Trainers,Male,38.00%,Inside: textile padding in the heel and tongue for optimal comfort  the rest of the area is made of textile  Outer Material: Leather  Sole: Rubber  Closure: Lace-Up  Heel Type: Low  Shoe Width: Schmal  Outsole: rubber with herringbone profile
New Balance Unisex Kid's 880v9 Running Shoe,£39.43 - £158.89,Visit the New Balance Store,https://m.media-amazon.com/images/I/41-N+83UCsL.jpg,https://www.amazon.co.uk/dp/B07BQV8NJC,Road Running Shoes,Running Shoes,Female,32.00%,Sole: Rubber  Closure: Lace-Up  Material Composition: Synthetic/ Mesh  Shoe Width: M
Skechers Afterburn M. Fit  Men's Afterburn M. Fit,£62.15 - £195.80,Visit the Skechers Store,https://m.media-amazon.com/images/I/41oA8ZPGpHL.jpg,https://www.amazon.co.uk/dp/B00FZN1OX4,Fashion Trainers,Fashion & Athletic Trainers,Male,14.00%,Outer Material: Synthetic  Sole: Rubber  Closure: Lace-Up  Heel Height: 2 inches  Shoe Width: Medium
Safety Trainers Men Women Lightweight Work Shoes Steel Toe Cap Breathable Industrial Sneakers,£29.99 - £37.03,Eagsouni,https://m.media-amazon.com/images/I/41fGkmRjEFL.jpg,https://www.amazon.co.uk/dp/B08FMHCPD1,Work & Utility Footwear,Men's Shoes,Male,18.00%,Outer Material: Synthetic  Inner Material: Synthetic Breathable and soft inner  Sole: Non-slip outsole provides a perfect grip in every direction.  Closure: Lace-Up  Heel Height: 2.5 centimetres  Heel Type: Flat  Material Composition: Mesh+Polyester+Rubber  Shoe Width: Medium  Safety Trainers: Perfect for construction site  exploitation site  forging workshop or manufacture. In the tough working environment  our shoes are guaranteed to be comfortable  durable and safe. These safety shoes can also work as hiking shoes for outdoor use.
Allonsi | Jager Mens Genuine Leather Tassel Loafers | Goodyear Welt Construction | Arpon Toe | Leather Sole | Handcrafted Luxury Leather Shoes,£147.93 - £154.85,Allonsi,https://m.media-amazon.com/images/I/31EQNKKU5vL.jpg,https://www.amazon.co.uk/dp/B089YJZKW9,Loafers & Moccasins,Men's Shoes,Male,26.00%,HANDCRAFTED PRECISION: Allonsi's Goodyear Welted Loafers for men are intricately constructed by experienced cordwainers in our distinguished workshops using traditional tools. Each pair is handcrafted by cutting and carving high quality leather  which provides a sophisticated look  extreme comfort  and natural ventilation.  UNMATCHED COMFORT: The century old Goodyear construction allows our collection of shoes for mens to provide optimum comfort. While the pair may seem a little stiff to wear at first  with gradual use  the shoe's footbed will adapt itself to the wearer's feet  thereby providing a custom fit like never before.  Outer Material: Leather  Sole: Leather  Closure: Pull On  Heel Type: low-heels  Shoe Width: Medium
FROGG TOGGS Women's Shortfin Shoe Footwear,£34.19 - £108.30,FROGG TOGGS,https://m.media-amazon.com/images/I/41RT8yyJ1QL.jpg,https://www.amazon.co.uk/dp/B082JF28ZV,Fashion Trainers,Fashion & Athletic Trainers,Female,26.00%,
Tango Latin Jazz Shoes Women's Shoes Modern Dance Shoes Ballroom Dance Shoes Women's Shoes,,HUIYUAN,https://m.media-amazon.com/images/I/41+1ywESWLL.jpg,https://www.amazon.co.uk/dp/B07QZD13SZ,Dance Shoes,Sports & Outdoor Shoes,Female,27.00%,Shoe width: synthetic material  Closure: Buckle  heel type: 0.5 kg  Advantages: leather anti-hair bottom  non-slip wear-resistant ultra-quiet  give you a quiet dancing environment; suitable for indoor scenes with smooth surface of dance studio carpet floor; three layers inside  reduce ground back shock with high permeability  high antibacterial and moisture resistance Stable and safe  distracting external force  comfortable and not tired  dancing more lasting
Women's Mesh Trainers Breathable Shoes Ladies Sneakers Thick Bottom Comfortable Sports Shoes Slip On Walking Shoes Loafers Low Top Shoes,£5.48 - £10.68,ZHIZIHUA,https://m.media-amazon.com/images/I/41eQmrsZNYL.jpg,https://www.amazon.co.uk/dp/B098T8X1RW,Fashion Trainers,Fashion & Athletic Trainers,Female,40.00%,【Shock Absorption】: Our Elastic Slip-On Flat Shoes are made with custom premium blend of materials to maximize comfortability while staying in style. Elegant Elastic Slip-on Flat Shoes. --- safety shoes for men women steel toe cap sneakers trainers work boots industrial shoes steel toe cap shoes lightweight safety footwear s1p s3 steel toe cap trainers src work shoes breathable work trainer  【Unique Design】: Fitting feet shape design make them looks beautiful and cool  suitable for all kinds of clothing and occasion  Gives the foot maximum range in movement  unique ankle design  very convenient to wear and take off --- wide fit tennis shoes women shoe lace walking trainer shoe athletic fit womens lightweight trainers workout shoes women walking trainer woman lightweight lady walking shoe orthotic trainers womens breathable trainers black slip trainer lady mesh work trainers  Outer Material: Upper with stretch breathable ultra light weight fabric for fast draining and cross ventilation  give excellent flexible and comfortable. -- Women Walking Shoes Athletic Trainers Lightweight Trainers Lightweight Ladies Sneakers Shock Gym Fitness Sports Slip On Slip on Running Shoes Tennis Outdoor Loafer Flats Casual Work Nursing Shoes  Inner Material: Fashion knitted mesh upper for ultra-lightweight support  very comfortable to wear. Let your foot always keep dry and cool --- Climbing Trekking Hiking Shoes Summer ladies womens tennis breathable shoes women lady ladies female road running fitness daily walking jogging Gym indoor work lightweight mesh leisure lace up flat fashion shoes Black size 2  Sole: Suitable for golf  daily walking  casual  outdoor  sports  tourism  camping  horse riding  driving  walking and etc.Perfect choice to pair with any sport or causal assemble. --- Table Tennis Shoes Climbing Shoes Cycling Shoes Boxing Shoes Softball Shoes Track & Field Shoes Trekking & Hiking Shoes Boating Shoes Basketball Shoes Badminton Shoes Gymnastics Shoes American Handball Shoes Cross Trainers Football Boots Field Hockey Shoes Road Running Shoes Running Shoes  Closure: 【Warm Reminder】The Size Mark On The shoes Is Chinese Size Number. (Such as Choosing 6 UK and you will receive a Chinese size 38 ). It is recommended to select the corresponding code number according to the length of the foot.  Heel Height: 4.5 centimetres  Heel Type: running trainer sport womens slip garden shoes womens black trainers white slip trainer casual trainer badminton shoes ladies ladies black walking shoes  Material Composition: Upper with stretch breathable ultra light weight fabric for fast draining and cross ventilation  give excellent flexible and comfortable.  Shoe Width: Medium
Ryka Women's Katana Sneaker  Black  6 Wide,£55.49,RYKA,https://m.media-amazon.com/images/I/31zGJQ+3dlL.jpg,https://www.amazon.co.uk/dp/B08PD7X2YJ,Nordic Walking Shoes,Sports & Outdoor Shoes,Female,22.00%,Sole: Rubber  Closure: Hook & Loop  Heel Height: 1.5 inches  Heel Type: Flat  Shoe Width: W
PUMA Unisex Kid's Tazon 6 Sneaker,£29.80 - £141.64,Visit the PUMA Store,https://m.media-amazon.com/images/I/419awJSAMuL.jpg,https://www.amazon.co.uk/dp/B07QRDFTK7,Fashion Trainers,Fashion & Athletic Trainers,Male,20.00%,Outer Material: Synthetic  Sole: Rubber  Closure: Lace-Up  Heel Height: 1 centimetres  Shoe Width: Medium
Merrell Men's Catalyst Suede Track Shoe  1,£78.98 - £182.00,Visit the Merrell Store,https://m.media-amazon.com/images/I/41PC27DL4yL.jpg,https://www.amazon.co.uk/dp/B084X5M3X7,Trekking & Hiking Footwear,Sports & Outdoor Shoes,Male,36.00%,Outer Material: Synthetic  Inner Material: Manmade  Sole: Synthetic  Closure: Lace-Up  Material Composition: Synthetic  Shoe Width: Medium
ASICS Men's Gel-Kayano Trainer Evo Fashion Sneaker,£170.00 - £223.97,ASICS,https://m.media-amazon.com/images/I/51pfrDOXqdL.jpg,https://www.amazon.co.uk/dp/B01BZB6SOO,Fashion Trainers,Fashion & Athletic Trainers,Male,17.00%,Revolutionized Mesh Overlay: The innovative mesh overlay provides excellent breathability as well as midfoot and forefoot support.  Outer Material: Synthetic  Sole: Rubber  Closure: Lace-Up  Shoe Width: Medium mens_us  Mono Sock and Rear Protector: The stretchy mono sock heel collar and rear protector not only provide the enhanced comfort  but also aid in adequate support and protection.
Under Armour Men's Architech 3di Valor Sneaker,£111.44 - £223.10,Visit the Under Armour Store,https://m.media-amazon.com/images/I/41MzW+FTc6L.jpg,https://www.amazon.co.uk/dp/B074ZCSR4M,Fashion Trainers,Fashion & Athletic Trainers,Male,39.00%,Sole: Rubber  Closure: Lace-Up  Shoe Width: Medium
UGG Unisex Kid's Keelan Metallic Glitter BOOT,£60.00,Visit the UGG Store,https://m.media-amazon.com/images/I/41BeK0eHp0L.jpg,https://www.amazon.co.uk/dp/B08PDVBYY4,Boots,Boys' Shoes,Male,23.00%,Outer Material: Suede  Inner Material: Wool  Sole: Rubber  Closure: Pull-On  Heel Type: Flat  Shoe Width: Medium
PANTOFOLA D’ORO 1886 Men's Foro Italico Low Oxford Flat,£138.16 - £227.99,PANTOFOLA D’ORO 1886,https://m.media-amazon.com/images/I/217+rFzVlOL.jpg,https://www.amazon.co.uk/dp/B0864MQ69T,Lace-ups,Men's Shoes,Male,27.00%,Outer Material: Smooth skin  Inner Material: Leather  Sole: Rubber  Closure: snare  Shoe Width: Medium
VWMYQ Womens Running Shoes Air Cushion Slip Resistant Comfortable Tennis Sneakers,£31.57 - £34.52,VWMYQ,https://m.media-amazon.com/images/I/41FUp6LOt9L.jpg,https://www.amazon.co.uk/dp/B08MKXSJ11,Road Running Shoes,Running Shoes,Female,39.00%,Air Cushioning-and-rubber sole: Soft  wear-resistant and elastic  suitable for all kinds of sports.  Insole: Low density PU material  soft texture  comfortable and lightweight  Excellent damping and anti-skid performance  can effectively absorb part of the reaction force  reduce the burden of the foot.  Outer Material: Mesh  Sole: Rubber  Closure: Lace-Up  Heel Height: 3 centimetres  Heel Type: Flat  Shoe Width: Medium  Knitted upper design: Woven vamp is very lightweight and soft  plus the knitting itself coil and mesh structure  the material breathability is good  wear on the foot will not have sweat odor.  Service: If you have any questions  please contact our customer service in time. We will reply to you within 24 hours.
Women's Sports Shoes Very Breathable and Lightweight with Platform Fashion Sports,£17.24 - £23.47,P&L,https://m.media-amazon.com/images/I/41vJ2ecchpL.jpg,https://www.amazon.co.uk/dp/B08R2CZGG5,Fashion Trainers,Fashion & Athletic Trainers,Female,18.00%,Outer material: Maya  Coating: fabric  Outer Material: Synthetic  Inner Material: Craft  Sole: Ethylene Vinyl Acetate  Closure: Lace-Up  Heel Height: 4 centimetres  Heel Type: Wedge  Shoe Width: Normal centimetres  Sole material: EVA foam  Closure: laces  Heel Type: Platform
Think! Kong Men’s Derby Lace-Up,£100.54 - £142.99,Think!,https://m.media-amazon.com/images/I/31kzWwowyvL.jpg,https://www.amazon.co.uk/dp/B015IQDZXE,Lace-ups,Men's Shoes,Male,32.00%,Outer Material: Leather  Inner Material: Leather  Sole: Rubber  Closure: Lace-Up  Heel Height: 1.5 centimetres  Heel Type: Block  Shoe Width: Normal
Creative Recreation Women's Cesario Lo XVI Fashion Sneaker Red/White Stripes 9.5 M US,£52.58,Creative Recreation,https://m.media-amazon.com/images/I/41oy1FQAagL.jpg,https://www.amazon.co.uk/dp/B002ZNKBM2,Fashion Trainers,Fashion & Athletic Trainers,Female,33.00%,Closure: Lace-Up  Heel Type: Low  Shoe Width: Medium
adidas Women's Terrex Agravic Flow W Cross Trainers,£75.08 - £164.32,Visit the adidas Store,https://m.media-amazon.com/images/I/41lWrs9elCL.jpg,https://www.amazon.co.uk/dp/B08VVKJJC4,Cross Trainers,Sports & Outdoor Shoes,Female,23.00%,Outer Material: Synthetic  Inner Material: Manmade  Sole: Synthetic  Closure: Lace-Up  Heel Type: Low  Material Composition: Synthetic  Shoe Width: Medium
Pablosky Girl's 343808 Ballet Flat,£24.90 - £31.61,Pablosky,https://m.media-amazon.com/images/I/41vNFRmKfkL.jpg,https://www.amazon.co.uk/dp/B08HJHGX8G,Ballet Flats,Girls' Shoes,Female,24.00%,Outer Material: Leather  Inner Material: Felt  Sole: Rubber  Closure: To put on  Heel Type: No Heel  Shoe Width: Medium
Mercury MXC Kids Boys Girls White School Trainers Pumps Hook and Loop Straps Size 8-2,£9.98 - £13.99,Mercury MXC,https://m.media-amazon.com/images/I/41a+kO8oZJL.jpg,https://www.amazon.co.uk/dp/B07GRXNDCK,Fashion Trainers,Fashion & Athletic Trainers,Male,30.00%,Outer Material: Faux Leather  Inner Material: Synthetic  Sole: Rubber  Closure: Hook & Loop  Heel Height: 2 centimetres  Heel Type: Flat  Shoe Width: Medium
Skechers Classic Fit-Delson-Camden  Men’s Sneakers,£44.30 - £197.90,Visit the Skechers Store,https://m.media-amazon.com/images/I/51lUSWxQyFL.jpg,https://www.amazon.co.uk/dp/B07567D3L5,Fashion Trainers,Fashion & Athletic Trainers,Male,30.00%,Outer Material: Synthetic  Inner Material: Textile  Sole: Ethylene Vinyl Acetate  Closure: Lace-Up  Heel Height: 2.5 centimetres  Heel Type: Flat  Shoe Width: Medium
Geox Baby Girl's B Rishon Low-Top Sneakers,£20.14 - £54.71,Visit the Geox Store,https://m.media-amazon.com/images/I/4130ydmlhSL.jpg,https://www.amazon.co.uk/dp/B07DJZYBPR,Fashion Trainers,Fashion & Athletic Trainers,Female,31.00%,Outer Material: Leather  Inner Material: Textile  Sole: Ethylene Vinyl Acetate  Closure: Hook & Loop  Heel Height: 2 centimetres  Heel Type: Flat  Fit Type: Geox shoes have a comfortable fit  Shoe Width: Medium
Minnie Mouse Flip Flops Ocean Waves Sea-Pool Size 29/30-31/32-33/34,£11.92,Sfiziosa,https://m.media-amazon.com/images/I/517lBbtf9TL.jpg,https://www.amazon.co.uk/dp/B089391BWD,Flip Flops & Thongs,Girls' Shoes,Female,32.00%,Outer Material: Synthetic  Closure: Slip On  Shoe Width: Normale
Berkemann Women's FAE Rcycl Sneaker,£22.36 - £145.15,Berkemann,https://m.media-amazon.com/images/I/418nxszVN0S.jpg,https://www.amazon.co.uk/dp/B08FJGKY9V,Fashion Trainers,Fashion & Athletic Trainers,Female,36.00%,Outer Material: Wool  Inner Material: Wool  Sole: Ethylene Vinyl Acetate  Closure: Schnellschnürung  Heel Type: Wedge  Shoe Width: Medium
Vans Men's Era 59 Trainers,£60.34 - £132.61,Visit the Vans Store,https://m.media-amazon.com/images/I/41J67H1DUgL.jpg,https://www.amazon.co.uk/dp/B074H8XYR5,Fashion Trainers,Fashion & Athletic Trainers,Male,20.00%,Outer Material: Canvas  Inner Material: Textile  Sole: Rubber  Closure: Lace-Up  Heel Type: Flat  Shoe Width: Medium
Clarks Women's Marie Mist Sneaker  Medium,£19.99 - £162.50,Visit the Clarks Store,https://m.media-amazon.com/images/I/41yQjKSTFqL.jpg,https://www.amazon.co.uk/dp/B07T72NM6C,Fashion Trainers,Fashion & Athletic Trainers,Female,15.00%,Outer Material: smooth leather  Sole: Rubber  Closure: Lace-Up  Heel Height: 1 inches  Shoe Width: M womens_us
rismart Women's Hidden Wedge Heel Lace Up Perfect Comfort Leather Trainers Shoes,£32.27 - £35.27,rismart,https://m.media-amazon.com/images/I/414j6oXJmAS.jpg,https://www.amazon.co.uk/dp/B072LS66LV,Fashion Trainers,Fashion & Athletic Trainers,Female,33.00%,Outer Material: Leather  Inner Material: Synthetic  Sole: Rubber  Closure: Lace-Up  Heel Height: 5.5 centimetres  Heel Type: Wedge  Material Composition: leather-and-synthetic  Shoe Width: Normal
Slydes Lucid Men's Sliders,£12.99 - £13.99,Visit the Slydes Store,https://m.media-amazon.com/images/I/41ATjwmD5FL.jpg,https://www.amazon.co.uk/dp/B07YSPT8YB,Sandals,Men's Shoes,Male,26.00%,Outer Material: Synthetic  Sole: Synthetic  Closure: Slip On  Heel Height: 3 centimetres  Heel Type: Flat  Material Composition: Synthetic  Shoe Width: Normal
Clarks Childrens Casual Hook and Loop Strap Shoes Tiny Sky T - Navy Leather - UK Size 4.5H - EU Size 20.5 - US Size 5XW,£32.99,Visit the Clarks Store,https://m.media-amazon.com/images/I/41PyM4HdYcS.jpg,https://www.amazon.co.uk/dp/B09317LDZ1,Girls' Shoes,Shoes,Female,36.00%,Outer Material: Smooth Leather  Inner Material: Leather  Sole: Synthetic  Closure: Hook & Loop  Heel Height: 1 centimetres  Heel Type: Flat  Shoe Width: Large
LNLJ Walking Shoes Comfortable Casual Arch Support Sneakers for Edema Feet Diabetic Swollen Feet Black US9.5/UK8.5/EU43,,LNLJ,https://m.media-amazon.com/images/I/41KXiC-aoDS.jpg,https://www.amazon.co.uk/dp/B098JQ9ZBS,Fashion Trainers,Fashion & Athletic Trainers,Female,25.00%,Ergonomic Design: These adjustable women's Velcro shoes are lightweight and sturdy.Special soft non-slip sole.Wide round toe breath cloth with elastic hollow out knit upper  More comfortable closely fit to help you reduce irritation.  Lightweight & Comfortable: Perfect work shoes for standing and walking for long periods of time;Wider sole design to absorb shock  to provide a forgiving  easeful feel in every foot strike. Removable insole with cushioning pads for extra comfort.The lightweight and sturdy sole provides grip for both indoor and outdoor wear.  Target User & Occasion: Ideal for those who need extra stretch  comfort and soft to accommodate Swollen Feet  Hammertoes  Bunions  Plantar Fasciitis  Corns  Calluses  Osteoarthritis  Rheumatoid Arthritis  Hammer Toes  Morton's Neuroma  Oedema  Dementia  Injuries involving tendons  muscles  and bones or need a Post-op shoe.  Satisfaction Guarantee: You are taking no risk with your purchase. If you are not thrilled with your purchase for any reason. Please email us at any time and we will reply to you within 24 hours. Just tell us and we will do our best to give you the most satisfactory solution. Please check our storefront for more slipper styles and other deals that are waiting for you
Geox Men's J Buller Boy D Sneaker,£50.00,Visit the Geox Store,https://m.media-amazon.com/images/I/41wqRP0tFLL.jpg,https://www.amazon.co.uk/dp/B08QNGLST7,Fashion Trainers,Fashion & Athletic Trainers,Male,29.00%,Outer Material: Synthetic  Inner Material: Canvas  Sole: Rubber  Closure: Hook & Loop  Heel Type: Flat  Shoe Width: Medium
Supra Women's Skytop High Sneakers,£34.90 - £44.55,Supra,https://m.media-amazon.com/images/I/318D+TjW5DL.jpg,https://www.amazon.co.uk/dp/B07C2VNHST,Fashion Trainers,Fashion & Athletic Trainers,Female,16.00%,Outer Material: Canvas  Sole: Suede  Closure: Lace-Up  Heel Height: 1 inches  Heel Type: Flat  Shoe Width: Medium womens_us
LUCKY-STEP Women Flats Glitter Sneakers | Lace Up Closed Sparkle Round Toe Flatform Fashion Sneakers,£25.01 - £50.09,LUCKY-STEP,https://m.media-amazon.com/images/I/41oYFOIDX3L.jpg,https://www.amazon.co.uk/dp/B07X6CT52B,Fashion Trainers,Fashion & Athletic Trainers,Female,38.00%,Material: Rubber sole + PU/glitter upper  Outer Material: Glitter  Sole: Rubber  Closure: Lace-Up  Heel Type: No Heel  Shoe Width: M  TOP QUALITY AND FASHION LOOKING: the design tends to make you looks fashion  PU upper offers super comfort and durability  the style can be for just about any outfit with designs to help accentuate your special and highlight your creative and fashionable.
Clarks Women's Kayleigh Band Sneaker,£27.10 - £75.52,Visit the Clarks Store,https://m.media-amazon.com/images/I/3123xfeMwzL.jpg,https://www.amazon.co.uk/dp/B08C5H4YPP,Fashion Trainers,Fashion & Athletic Trainers,Female,29.00%,Outer Material: Synthetic  Inner Material: Manmade  Sole: Synthetic  Closure: Pull On  Shoe Width: Medium
Clarks Men's Oakland Run Derbys,£36.43 - £117.38,Visit the Clarks Store,https://m.media-amazon.com/images/I/313ox67SStL.jpg,https://www.amazon.co.uk/dp/B07TPYVDMQ,Lace-ups,Men's Shoes,Male,20.00%,Upper material: leather  Inner material: leather  Outer Material: Leather  Inner Material: Leather  Sole: Rubber  Closure: Lace-Up  Shoe Width: Normal  Sole: rubber
New Balance Boy's 574v1 Sneaker,£33.94 - £48.40,Visit the New Balance Store,https://m.media-amazon.com/images/I/4115WeP0JPL.jpg,https://www.amazon.co.uk/dp/B08MWMMHQ5,Fashion Trainers,Fashion & Athletic Trainers,Male,39.00%,Outer Material: Patent-Leather  Inner Material: Synthetic  Sole: Rubber  Closure: Hook & Loop  Heel Type: Flat  Shoe Width: Medium
Sorel Children's Unisex Winter Boots  Youth Caribou,£62.66 - £104.82,Visit the Sorel Store,https://m.media-amazon.com/images/I/41rflmiPd7L.jpg,https://www.amazon.co.uk/dp/B001ATIMEQ,Boots,Boys' Shoes,Male,38.00%,Outer Material: Leather  Inner Material: Manmade  Sole: Rubber  Closure: Pull-On  Heel Height: 3 centimetres  Heel Type: Flat  Material Composition: 51% Leather  39% Rubber  10% Textile  Fit Type: Regular size  Shaft Diameter: Regular  Shoe Width: Normal
British Knights Women's Ivy Sneaker,£36.83 - £70.87,British Knights,https://m.media-amazon.com/images/I/41c+r8m7F1L.jpg,https://www.amazon.co.uk/dp/B08PPTXZ2K,Fashion Trainers,Fashion & Athletic Trainers,Female,28.00%,Insole material: cotton  Outer material: EVA  Outer Material: Synthetic  Inner Material: Manmade  Sole: Ethylene Vinyl Acetate  Closure: Lace-Up  Heel Type: Flat  Shoe Width: Medium  Lining material: cotton  Outer material: synthetic
ROXY Women's Cabo Flip Flops  3 UK,£23.75 - £36.94,Roxy,https://m.media-amazon.com/images/I/31HtQddIztL.jpg,https://www.amazon.co.uk/dp/B00ZUYKN8K,Beach Flip Flops & Pool Slides,Sports & Outdoor Shoes,Female,39.00%,Outer Material: Synthetic  Sole: Rubber  Closure: Slip On  Heel Type: No Heel  Shoe Width: Medium womens_us
ASICS Men's Court Ff 2 Clay Road Running Shoe,£155.00,ASICS,https://m.media-amazon.com/images/I/41pk9LewyZL.jpg,https://www.amazon.co.uk/dp/B096MVZSJP,Road Running Shoes,Running Shoes,Male,35.00%,Outer Material: Synthetic  Inner Material: Manmade  Sole: Ethylene Vinyl Acetate  Closure: Lace-Up  Heel Type: Flat  Shoe Width: Medium
Zuwoigo Women's Slip On Sneakers Casual Lightweight Breathable Walking Shoes,£24.64 - £42.02,Zuwoigo,https://m.media-amazon.com/images/I/41mINmgauNL.jpg,https://www.amazon.co.uk/dp/B08MF5MSH4,Fashion & Athletic Trainers,Women's Shoes,Female,40.00%,Closure: Pull On  Heel Height: 2.5 centimetres  Shoe Width: Regular  The comfortable footware apply to: casual  walking  running  indoor  sports  outdoor  travel  exercise  workout and any occasion.
Leviton 41292-3RG Multimedia Outlet System 3-Port RCA Module Feedthrough  Grey,£56.52,Leviton,https://m.media-amazon.com/images/I/413OY2i9U4L.jpg,https://www.amazon.co.uk/dp/B003AUFCDC,Bowling Shoes,Sports & Outdoor Shoes,Female,35.00%,Includes A/V specified colors: red-right  black-left  yellow-video (composite); red-PR  blue-PB  green-Y (component)
lumberjack Women's Raul Gymnastics Shoes,£51.20 - £87.61,Lumberjack,https://m.media-amazon.com/images/I/31To6bKDQFL.jpg,https://www.amazon.co.uk/dp/B07KYGB2LY,Fashion Trainers,Fashion & Athletic Trainers,Female,10.00%,Designer: Lumberjack  Item: SW01305-008 P  Outer Material: Leather  Inner Material: Textile  Sole: Rubber  Closure: Lace-Up  Heel Height: 5 centimetres  Heel Type: Wedge  Shoe Width: Medium  Color:   Season: Spring/Summer
XINGJU Mens Business Dress Formal Walking Leather Shoes Non Slip Casual Snakeskin Is Ideal For Prom Night Men Brown-EU37,,XINGJU,https://m.media-amazon.com/images/I/41w8mNdnsYL.jpg,https://www.amazon.co.uk/dp/B085NWFG3S,Loafers & Moccasins,Men's Shoes,Male,33.00%,
Pepe Jeans Woking Urban  Women's Low-Top Sneakers,£66.99 - £75.99,Visit the Pepe Jeans Store,https://m.media-amazon.com/images/I/41HA31mFxcL.jpg,https://www.amazon.co.uk/dp/B08TRPS4Z3,Fashion Trainers,Fashion & Athletic Trainers,Female,24.00%,Outer Material: Suede Leather  Sole: Rubber  Closure: Lace-Up  Shoe Width: Medium
G-STAR RAW Men's Roofer Black Fashion Boot,£50.95 - £229.95,Visit the G-STAR RAW Store,https://m.media-amazon.com/images/I/51v8DKkSSgL.jpg,https://www.amazon.co.uk/dp/B06X1CY1TF,Boots,Men's Shoes,Male,32.00%,Outer Material: Leather  Sole: Rubber  Closure: Lace-Up  Shoe Width: Medium
New Rock Neobiker M-7605-s20 Unisex Platform Boots,£126.00,New Rock,https://m.media-amazon.com/images/I/51jEcpftXWL.jpg,https://www.amazon.co.uk/dp/B01IRHFY44,Boots,Men's Shoes,Male,39.00%,Outer Material: Leather  Inner Material: Leather  Sole: Rubber  Closure: Pull On  Heel Height: 4.4 centimetres  Heel Type: Flat  Shoe Width: Medium
adidas Stan Smith J Black Youth Trainers Size 3.5 UK,£65.00,adidas Originals,https://m.media-amazon.com/images/I/41QD1+4tI7L.jpg,https://www.amazon.co.uk/dp/B00OLSH49M,Fashion Trainers,Fashion & Athletic Trainers,Male,35.00%,Sole: Rubber  Closure: Lace-Up  Heel Height: 1 inches  Heel Type: Low  Shoe Width: M
GGBLCS Kids 7 Colors Changing LED Roller Skate Shoes with Double Wheels Inline Automatic Retractable Technical Skateboarding Girls Boys Sport Cross Trainers,£51.99,GGBLCS,https://m.media-amazon.com/images/I/51cGLsmHB7S.jpg,https://www.amazon.co.uk/dp/B09696NM9L,Technical Skateboarding Shoes,Sports & Outdoor Shoes,Male,18.00%,[Material] Outer Material: 2 Wheels (comfortable material  dry inside  trendy  fashionable  lightweight design  moisture absorption soft and comfortable)
